id_course;title_course;description_course;id_instructor_course;image_course;price_course;date_created_course;date_updated_course
1;Angular: De cero a experto creando aplicaciones (Angular 8+);Todo lo que necesitas saber de angular utilizando TypeScript y buenas pr cticas ofrecidas por el equipo de angular.;1;https://i.udemycdn.com/course/480x270/1075334_8b5f_4.jpg;199.99;2021-10-19;2021-10-19 23:59:00
2;Desarrollo Web Completo con HTML5, CSS3, JS AJAX PHP y MySQL;Aprende Desarrollo Web con este curso 100% pr ctico, paso a paso y sin conocimientos previos, INCLUYE PROYECTO FINAL;2;https://i.udemycdn.com/course/480x270/980450_7fc0_3.jpg;199.99;2021-10-19;2021-10-19 23:59:00
3;Programaci¢n de Android desde Cero +35 horas Curso COMPLETO;Aprender a programar aplicaciones y juegos para Android de forma profesional y desde cero.;3;https://i.udemycdn.com/course/480x270/957106_270f_6.jpg;199.99;2021-10-19;2021-10-19 23:59:00
4;Universidad Java: De Cero a Master +82 hrs (JDK 13 update)!;El mejor curso para aprender Java, POO, JDBC, Servlets, JSPs, Java EE, Web Services, JSF, EJB, JPA, PrimeFaces y JAX-RS!;4;https://i.udemycdn.com/course/480x270/1265942_7e2f_9.jpg;199.99;2021-10-19;2021-10-19 23:59:00
5;Curso Maestro de Python 3: Aprende Desde Cero;Aprende a programar con clases y objetos, a usar ficheros y bases de datos SQLite, interfaces gr ficas y m s con Python;5;https://i.udemycdn.com/course/480x270/882422_0549_9.jpg;199.99;2021-10-19;2021-10-19 23:59:00
6;Master en JavaScript: Aprender JS, jQuery, Angular 8, NodeJS;Master en JavaScript: Aprender JS, jQuery, Angular 8, NodeJS;6;https://i.udemycdn.com/course/480x270/1337000_0d99.jpg;199.99;2021-10-19;2021-10-19 23:59:00
7;Master en Programaci¢n de Videojuegos con Unity© 2019 y C#;Aprende a programar videojuegos desde cero a nivel AVANZADO y profesional con Unity© 2019;7;https://i.udemycdn.com/course/480x270/371090_f92b_6.jpg;199.99;2021-10-19;2021-10-19 23:59:00
8;Dise¤o Web Desde Cero a Avanzado 45h Curso COMPLETO;Aprende a Dise¤ar P ginas Web Responsive Design, atractivas, de forma profesional y sin dificultad con HTML5 y CSS3;3;https://i.udemycdn.com/course/480x270/809410_4666_6.jpg;199.99;2021-10-19;2021-10-19 23:59:00
9;Dise¤o Web Profesional El Curso Completo, Pr ctico y desde 0;HTML5, CSS3, Responsive Design, Adobe XD, SASS, JavaScript, jQuery, Bootstrap 4, WordPress, Git, GitHub;8;https://i.udemycdn.com/course/480x270/782428_b5cf_4.jpg;199.99;2021-10-19;2021-10-19 23:59:00
10;PHP 7 y MYSQL: El Curso Completo, Pr ctico y Desde Cero !;HTML5, CSS3, Responsive Design, Adobe XD, SASS, JavaScript, jQuery, Bootstrap 4, WordPress, Git, GitHub;8;https://i.udemycdn.com/course/480x270/672600_1def_7.jpg;199.99;2021-10-19;2021-10-19 23:59:00
11;Curso de C++: B sico a Avanzado;Curso dise¤ado para principiantes o estudiantes universitarios sin conocimientos previos del lenguaje;9;https://i.udemycdn.com/course/480x270/763172_d61c_4.jpg;199.99;2021-10-19;2021-10-19 23:59:00
12;Node: De cero a experto;Curso dise¤ado para principiantes o estudiantes universitarios sin conocimientos previos del lenguaje;1;https://i.udemycdn.com/course/480x270/1562070_d426.jpg;199.99;2021-10-19;2021-10-19 23:59:00
13;Master en PHP, SQL, POO, MVC, Laravel, Symfony, WordPress +;Aprende PHP desde cero, bases de datos, SQL, MySQL, POO, MVC, Librer¡as, Laravel 5 y 6, Symfony 4 y 5, WordPress +56h;6;https://i.udemycdn.com/course/480x270/1438222_0ec3_4.jpg;199.99;2021-10-19;2021-10-19 23:59:00
14;Aprende Programaci¢n en C desde cero;Metodolog¡a, Algoritmos, Estructura de Datos y Organizaci¢n de Archivos;10;https://i.udemycdn.com/course/480x270/728634_9428_7.jpg;199.99;2021-10-19;2021-10-19 23:59:00
15;ionic 2 y ionic 3: Crea apps para Android e iOS desde cero.;Creemos apps para nuestros dispositivos m¢viles con el conocimiento que tenemos de Angular, HTML, CSS y JavaScript;1;https://i.udemycdn.com/course/480x270/1145678_760a_6.jpg;199.99;2021-10-19;2021-10-19 23:59:00
16;JavaScript: de cero hasta los detalles;En este poderoso lenguaje de programaci¢n web cada d¡a m s utilizado;1;https://i.udemycdn.com/course/480x270/751768_27d8.jpg;199.99;2021-10-19;2021-10-19 23:59:00
17;Curso de Angular 8 - Desde cero hasta profesional;Aprende a desarrollar aplicaciones web modernas de forma pr ctica y desde cero con Angular 4, 5, 6, 7 y 8 (Angular 2+);6;https://i.udemycdn.com/course/480x270/1156926_b2c4_6.jpg;199.99;2021-10-19;2021-10-19 23:59:00
18;Curso completo de Machine Learning: Data Science en Python;Aprende los algoritmos de Machine Learning con Python para convertirte en un Data Science con todo el c¢digo para usar;11;https://i.udemycdn.com/course/480x270/1606018_069c.jpg;199.99;2021-10-19;2021-10-19 23:59:00
19;Flutter: Tu gu¡a completa de desarrollo para IOS y Android;Push, C mara, Mapas, REST API, SQLite, CRUD, Tokens, Storage, Preferencias de usuario, PlayStore, AppStore, Bloc y m s!;1;https://i.udemycdn.com/course/480x270/2306140_8181.jpg;199.99;2021-10-19;2021-10-19 23:59:00
20;Angular Avanzado: Lleva tus bases al siguiente nivel - MEAN;MEAN, Google Signin, JWT, carga de archivos, lazyload, optimizaciones, Git, GitHub, panel administrativo y mucho m s.;1;https://i.udemycdn.com/course/480x270/1420028_b32f.jpg;199.99;2021-10-19;2021-10-19 23:59:00
21;React JS + Redux + ES6. Completo ­De 0 a experto! (espa¤ol);El curso de React en espa¤ol m s elegido. Desarrollo en forma pr ctica, ejemplos, fundamentos y herramientas £tiles;12;https://i.udemycdn.com/course/480x270/1374394_f1a8_2.jpg;199.99;2021-10-19;2021-10-19 23:59:00
22;Spring Framework 5: Creando webapp de cero a experto (2019);Construye aplicaciones web reales con Spring Framework 5 & Spring Boot: Thymeleaf, JPA, Security, REST, Angular, WebFlux;13;https://i.udemycdn.com/course/480x270/1388250_e9ac_6.jpg;199.99;2021-10-19;2021-10-19 23:59:00
23;GIT+GitHub: Todo un sistema de control de versiones de cero;No vuelvas a perder tu trabajo por cualquier tipo de problema, aprende a trabajar de una forma segura y en equipo;1;https://i.udemycdn.com/course/480x270/1235212_3204_2.jpg;199.99;2021-10-19;2021-10-19 23:59:00
24;Curso de TypeScript - El lenguaje utilizado por Angular 2;Aprende JavaScript orientado a objetos con TypeScript el lenguaje usado en Angular 2 (nuevo y mejorado AngularJS);6;https://i.udemycdn.com/course/480x270/914024_9850.jpg;199.99;2021-10-19;2021-10-19 23:59:00
25;Crea sistemas POS Inventarios y ventas con PHP y AdminLTE;Aprende JavaScript orientado a objetos con TypeScript el lenguaje usado en Angular 2 (nuevo y mejorado AngularJS);14;https://i.udemycdn.com/course/480x270/1467412_94b5_11.jpg;199.99;2021-10-19;2021-10-19 23:59:00
26;Curso de Desarrollo Web Completo 2.0;­Aprende haciendo! HTML5, CSS3, Javascript, jQuery, Bootstrap 4, WordPress, PHP, MySQL, APIs, apps m¢viles y Python;15;https://i.udemycdn.com/course/480x270/834866_4564_2.jpg;199.99;2021-10-19;2021-10-19 23:59:00
27;Aprende Programaci¢n C# con Visual Studio desde cero.;Aprende una s¢lida base de programaci¢n con Visual Studio, C# y el Framework .NET;7;https://i.udemycdn.com/course/480x270/797188_b203_5.jpg;199.99;2021-10-19;2021-10-19 23:59:00
28;Bootstrap 4: El Curso Completo, Pr ctico y Desde Cero;Aprende a crear cualquier sitio web adaptable a dispositivos m¢viles con Boostrap 4, el mejor framework de dise¤o web;8;https://i.udemycdn.com/course/480x270/1245130_efdb_5.jpg;199.99;2021-10-19;2021-10-19 23:59:00
29;Desarrollo Web con Spring Boot - De Cero a Ninja;El curso definitivo de Spring Framework 4.3 desde cero: Spring Boot + Rest + MVC + Security + Data JPA + Thymeleaf;16;https://i.udemycdn.com/course/480x270/984636_5a01_8.jpg;199.99;2021-10-19;2021-10-19 23:59:00
30;iOS y Swift : Curso Completo de Cero a Profesional;Aprende a Desarrollar Apps M¢viles para iPhone y iPad en Swift Desde Cero con el Mejor Curso de iOS y Swift en Espa¤ol.;17;https://i.udemycdn.com/course/480x270/1242552_1235_4.jpg;199.99;2021-10-19;2021-10-19 23:59:00
31;Crea sistemas Ecommerce con PHP con pagos de PAYPAL y PAYU;Aprende a crear tu propio ecosistema de comercio electr¢nico con PHP 7 usando AdminLTE y recibe pagos con PAYPAL y PAYU;14;https://i.udemycdn.com/course/480x270/1322574_f1bd_10.jpg;199.99;2021-10-19;2021-10-19 23:59:00
32;Fundamentos de Programaci¢n;Aprende las Bases de la Programaci¢n en 9 lenguajes a la vez: Java, Python, Go, C++, PHP, Ruby, C#, JavaScript y C;3;https://i.udemycdn.com/course/480x270/1192848_e63a.jpg;199.99;2021-10-19;2021-10-19 23:59:00
33;ionic 5: Crear aplicaciones IOS, Android y PWAs con Angular;Google Play Store, Apple App Store, PWAs, Push Notifications, despliegues en la web, tabletas y mucho m s;1;https://i.udemycdn.com/course/480x270/2088520_5480.jpg;199.99;2021-10-19;2021-10-19 23:59:00
34;Curso Completo de iOS 10 y Swift 3: de Cero a Experto con JB;El Curso m s actualizado de iOS 10 y Swift 3 en espa¤ol. Desarrollo completo de apps m¢viles para iPhone y iPad en Swift;11;https://i.udemycdn.com/course/480x270/883176_ad3a_4.jpg;199.99;2021-10-19;2021-10-19 23:59:00
35;Desarrollo de sistemas web en PHP 7 POO, MySQL, Jquery Ajax;Dise¤a sistemas web en PHP Orientado Objetos, MariaDB (MySql), Jquery Ajax, HTML5 CSS3 Bootstrap INCLUYE PROYECTO FINAL;18;https://i.udemycdn.com/course/480x270/1149390_0753_5.jpg;199.99;2021-10-19;2021-10-19 23:59:00
36;Desarrollo web con JavaScript, Angular, NodeJS y MongoDB;Aprende a desarrollar una webapp como Spotify usando el MEAN Stack (Node, MongoDB, Express, JWT y Angular 4, 5, 6, 7, 8);6;https://i.udemycdn.com/course/480x270/1023976_d8a0_9.jpg;199.99;2021-10-19;2021-10-19 23:59:00
37;Dominando Laravel - De principiante a experto;Aprende a crear aplicaciones robustas y escalables con el framework m s popular de PHP, Laravel;19;https://i.udemycdn.com/course/480x270/1126742_f0d3_3.jpg;199.99;2021-10-19;2021-10-19 23:59:00
38;Aprender a programar con Java. De cero hasta hacer sistemas;­Ahora con JavaFX! Aprende conceptos b sicos de programaci¢n hasta el desarrollo de un sistema completo con Java.;20;https://i.udemycdn.com/course/480x270/908106_359a_2.jpg;199.99;2021-10-19;2021-10-19 23:59:00
39;Java y BlueJ | Introducci¢n a las Bases de la Programaci¢n;Curso B sico introductorio del lenguaje Java para personas que no saben programar a£n.;20;https://i.udemycdn.com/course/480x270/948840_f991.jpg;199.99;2021-10-19;2021-10-19 23:59:00
40;Crea tu Tienda Online Sin Inventario y Aprende Dropshipping;Aprende Dropshipping, Crea tu Tienda Online, Lanzate al mercado y obt‚n tus primeras ventas sin Comprar inventario!;21;https://i.udemycdn.com/course/480x270/546338_4f43_3.jpg;199.99;2021-10-19;2021-10-19 23:59:00
41;Aprende Programaci¢n en C++ (B sico - Intermedio - Avanzado);Si eres un apasionado de la programaci¢n, este curso te interesa. aprender s desde las bases hasta lo avanzado en C++;10;https://i.udemycdn.com/course/480x270/484388_ab1c_2.jpg;199.99;2021-10-19;2021-10-19 23:59:00
42;Curso Completo de Desarrollo ASP.NET MVC;Crea aplicaciones web f cilmente con .Net Framework;22;https://i.udemycdn.com/course/480x270/1209326_ca41_6.jpg;199.99;2021-10-19;2021-10-19 23:59:00
43;Git y GitHub Completo Desde Cero;Aprende Git y GitHub de forma completa y desde cero. Con ejemplos pr cticos. S‚ un profesional del control de versiones.;3;https://i.udemycdn.com/course/480x270/940740_4db9_4.jpg;199.99;2021-10-19;2021-10-19 23:59:00
44;Curso Completo Python 3 - Desde las Bases hasta Django;Django,Flask,Bases del lenguaje, Programaci¢n Orientada a Objetos, Lectura y Escritura de Archivos y Bases de Datos;23;https://i.udemycdn.com/course/480x270/1114896_e264_3.jpg;199.99;2021-10-19;2021-10-19 23:59:00
45;React - La Gu¡a Completa - Hooks Redux Context +15 Proyectos;Incluye React Hooks, Cloud Firestore, Redux, React Router, NextJS, Axios, REST API's, Seguridad, Autenticaci¢n y CRUDS!;2;https://i.udemycdn.com/course/480x270/1756340_0543_4.jpg;199.99;2021-10-19;2021-10-19 23:59:00
46;Curso completo de Machine Learning: Data Science con Rstudio;Aprende a analizar datos estad¡sticos con los trucos de Juan Gabriel Gomila, prof. de Universidad de las Islas Baleares;11;https://i.udemycdn.com/course/480x270/1483710_7395_2.jpg;199.99;2021-10-19;2021-10-19 23:59:00
47;Desarrollo Profesional de Temas y Plugins de WordPress;Aprende a crear Temas, Plugins y Bloques de Gutenberg con este curso pr ctico CREA SITIOS 100% DINAMICOS en WordPress;2;https://i.udemycdn.com/course/480x270/378726_c37d_5.jpg;199.99;2021-10-19;2021-10-19 23:59:00
48;M ster en PHP, POO, MVC, MySQL, Laravel, CodeIgniter;­Aprende PHP y MySQL desde cero y crea tu propio CMS y API REST, usando los Framework de Laravel 6+ y CodeIgniter 4!;14;https://i.udemycdn.com/course/480x270/970528_f38a_3.jpg;199.99;2021-10-19;2021-10-19 23:59:00
49;Desarrollo de Aplicaciones m¢viles Android con App Inventor;­Crea incre¡bles aplicaciones m¢viles para Android sin programar utilizando App Inventor! 33 apps paso a paso;15;https://i.udemycdn.com/course/480x270/486808_1e8f_2.jpg;199.99;2021-10-19;2021-10-19 23:59:00
50;SQL. Curso completo de SQL. Aprende desde cero.;Aprende SQL desde cero para saber manejar cualquier base de datos;24;https://i.udemycdn.com/course/480x270/2137076_bbdf_4.jpg;199.99;2021-10-19;2021-10-19 23:59:00
51;AngularJS - Desde Hola Mundo hasta una Aplicaci¢n;Aprende como crear aplicaciones web con esta incre¡ble herramienta de desarrollo potenciada por Google, AngularJS.;1;https://i.udemycdn.com/course/480x270/467470_b749_3.jpg;199.99;2021-10-19;2021-10-19 23:59:00
52;Aprende Programaci¢n en Java (de B sico a Avanzado);En este curso Aprender s a programar en el lenguaje de programaci¢n Java, con un curso 30% te¢rico, 70% practico.;10;https://i.udemycdn.com/course/480x270/802946_e81d.jpg;199.99;2021-10-19;2021-10-19 23:59:00
53;Curso Pr ctico de Django: Aprende Creando 3 Webs;Curso Pr ctico de Django: Aprende Creando 3 Webs;5;https://i.udemycdn.com/course/480x270/1444542_d3b8_3.jpg;199.99;2021-10-19;2021-10-19 23:59:00
54;Master Unreal Engine 4 Desarrollo Videojuegos con Blueprints;Aprende a crear Videojuegos AAA DESDE CERO, desarrollo y programaci¢n completo con Blueprints y Unreal Engine 4;7;https://i.udemycdn.com/course/480x270/1223302_ae33.jpg;199.99;2021-10-19;2021-10-19 23:59:00
55;Curso de Angular 2 en Espa¤ol - Crea webapps desde cero;Aprende a desarrollar aplicaciones web modernas de forma pr ctica y desde cero con Angular 2, el sucesor de AngularJS;6;https://i.udemycdn.com/course/480x270/707908_13d1_3.jpg;199.99;2021-10-19;2021-10-19 23:59:00
56;Crea sistemas web ASP. Net Core 3.0 MVC, Entity Framework;Dise¤a aplicaciones web en ASP. Net Core 3 MVC y Entity Framework Core, utilizando jquery, AJAX - INCLUYE PROYECTO FINAL;18;https://i.udemycdn.com/course/480x270/1319300_052f_4.jpg;199.99;2021-10-19;2021-10-19 23:59:00
57;JavaScript Moderno Gu¡a Definitiva Construye +15 Proyectos;Aprende el lenguaje de programaci¢n web m s popular paso a paso Con Proyectos, inc. Electron React MongoDB Node Express;2;https://i.udemycdn.com/course/480x270/1509816_dff8.jpg;199.99;2021-10-19;2021-10-19 23:59:00
58;Angular: El mejor curso de Angular. De Cero a Experto!;Domina Angular 2 (Angular 8) y crea aplicaciones web del mundo real con TypeScript, Firebase, Cloud Firestore, JWT y m s;4;https://i.udemycdn.com/course/480x270/2105384_9a0f_8.jpg;199.99;2021-10-19;2021-10-19 23:59:00
59;PWA - Aplicaciones Web Progresivas: De cero a experto;Notificaciones PUSH, sincronizaci¢n sin conexi¢n, modos offline, instalaciones, indexedDB, push server, share y m s;1;https://i.udemycdn.com/course/480x270/1894936_31a7.jpg;199.99;2021-10-19;2021-10-19 23:59:00
60;Aprende a crear tu primer sitio web con Laravel 5.4;Curso introductorio a Laravel PHP;19;https://i.udemycdn.com/course/480x270/1104380_304c_5.jpg;199.99;2021-10-19;2021-10-19 23:59:00
